index	original	level	original_spaced_punc	original_no_punc	scrambled	scrambled_final_punc	scrambled_no_punc	verbs_scrambled
90	Tom Stafford bekijkt “The psychology of Tetris”.	B1+	Tom Stafford bekijkt “The psychology of Tetris” .	Tom Stafford bekijkt “The psychology of Tetris”	of psychology bekijkt “The . Tetris” Stafford Tom	of psychology bekijkt “The Tetris” Stafford Tom .	of psychology bekijkt “The Tetris” Stafford Tom	Tom Stafford “The psychology of Tetris” . bekijkt
91	Tom beschrijft het Zeigarnik Effect waar bij ons brein zich richt op nog niet voltooide taken, maar voltooide taken ook weer direct vergeet.	B1+	Tom beschrijft het Zeigarnik Effect waar bij ons brein zich richt op nog niet voltooide taken , maar voltooide taken ook weer direct vergeet .	Tom beschrijft het Zeigarnik Effect waar bij ons brein zich richt op nog niet voltooide taken maar voltooide taken ook weer direct vergeet	taken brein , richt waar . Effect zich Zeigarnik maar taken direct bij weer op ook nog beschrijft voltooide het voltooide Tom niet vergeet ons	taken brein , richt waar Effect zich Zeigarnik maar taken direct bij weer op ook nog beschrijft voltooide het voltooide Tom niet vergeet ons .	taken brein richt waar Effect zich Zeigarnik maar taken direct bij weer op ook nog beschrijft voltooide het voltooide Tom niet vergeet ons	Tom het Zeigarnik Effect richt waar bij ons beschrijft brein zich op nog niet voltooide taken , maar voltooide taken ook weer direct . vergeet
92	Een verschijnsel dat ik in de klas ook wel zie.	B1+	Een verschijnsel dat ik in de klas ook wel zie .	Een verschijnsel dat ik in de klas ook wel zie	ook klas . ik zie Een dat verschijnsel wel de in	ook klas ik zie Een dat verschijnsel wel de in .	ook klas ik zie Een dat verschijnsel wel de in	Een verschijnsel dat ik in de zie klas ook wel .
93	Leerlingen zijn druk bezig met een opdracht of opgave.	B1+	Leerlingen zijn druk bezig met een opdracht of opgave .	Leerlingen zijn druk bezig met een opdracht of opgave	opdracht bezig opgave druk een zijn . Leerlingen of met	opdracht bezig opgave druk een zijn Leerlingen of met .	opdracht bezig opgave druk een zijn Leerlingen of met	Leerlingen druk zijn bezig met een opdracht of opgave .
94	Ze overleggen met buren.	B1+	Ze overleggen met buren .	Ze overleggen met buren	. Ze buren overleggen met	Ze buren overleggen met .	Ze buren overleggen met	overleggen Ze met buren .
95	Komen tot een juiste conclusie.	B1+	Komen tot een juiste conclusie .	Komen tot een juiste conclusie	conclusie juiste Komen een . tot	conclusie juiste Komen een tot .	conclusie juiste Komen een tot	tot een juiste conclusie Komen .
96	En als ik dan even later een andere opdracht geeft over hetzelfde onderwerp dan hebben leerlingen geen idee meer.	B1+	En als ik dan even later een andere opdracht geeft over hetzelfde onderwerp dan hebben leerlingen geen idee meer .	En als ik dan even later een andere opdracht geeft over hetzelfde onderwerp dan hebben leerlingen geen idee meer	over als dan hetzelfde leerlingen later onderwerp even dan andere ik opdracht hebben En idee . meer een geen geeft	over als dan hetzelfde leerlingen later onderwerp even dan andere ik opdracht hebben En idee meer een geen geeft .	over als dan hetzelfde leerlingen later onderwerp even dan andere ik opdracht hebben En idee meer een geen geeft	En als ik dan even later een andere opdracht over hetzelfde onderwerp dan leerlingen geen idee meer geeft . hebben
97	Dit voorjaar is het vijf jaar geleden dat we bij Voys begonnen met Holacracy.	B1+	Dit voorjaar is het vijf jaar geleden dat we bij Voys begonnen met Holacracy .	Dit voorjaar is het vijf jaar geleden dat we bij Voys begonnen met Holacracy	met . jaar begonnen voorjaar vijf is Dit het we geleden bij dat Holacracy Voys	met jaar begonnen voorjaar vijf is Dit het we geleden bij dat Holacracy Voys .	met jaar begonnen voorjaar vijf is Dit het we geleden bij dat Holacracy Voys	Dit voorjaar het vijf jaar geleden is dat we bij Voys met Holacracy begonnen .
98	Hoe staat het er nu voor en wat hebben we geleerd van het organisatiemodel?	B1+	Hoe staat het er nu voor en wat hebben we geleerd van het organisatiemodel ?	Hoe staat het er nu voor en wat hebben we geleerd van het organisatiemodel	en ? het van wat we het Hoe voor staat hebben organisatiemodel geleerd nu er	en het van wat we het Hoe voor staat hebben organisatiemodel geleerd nu er ?	en het van wat we het Hoe voor staat hebben organisatiemodel geleerd nu er	Hoe het er nu voor en wat staat we geleerd van hebben het organisatiemodel ?
99	Dat vertellen we in de reeks ‘5 jaar Holacracy’.	B1+	Dat vertellen we in de reeks ‘5 jaar Holacracy’ .	Dat vertellen we in de reeks ‘5 jaar Holacracy’	Dat vertellen reeks de ‘5 we in jaar . Holacracy’	Dat vertellen reeks de ‘5 we in jaar Holacracy’ .	Dat vertellen reeks de ‘5 we in jaar Holacracy’	Dat we in de reeks ‘5 jaar Holacracy’ . vertellen
